{
  "batch_id": "P04-NEUTRAL-004-TD",
  "pack_id": "venus-cards-core",
  "schema_version": 1,
  "policy_revision": "RE-1",
  "mode": "truth_or_dare",
  "count": 20,
  "id_range": [
    1061,
    1080
  ],
  "meeting_contexts": [
    "online",
    "in_person"
  ],
  "allowed_interactions": [
    "solo"
  ],
  "relationship_scope_distribution": {
    "none": 20
  },
  "comfort_distribution": {
    "0": 20
  },
  "progression_distribution": {
    "1": 20
  },
  "languages": [
    "ru",
    "en",
    "tr"
  ],
  "forbidden_categories": [
    "explicit_sex",
    "pressure",
    "humiliation",
    "unsafe_separation"
  ],
  "source_catalog_digest": "sha256:1bbae9eab742f885b374e81bd30cc65f9051c29080404486da188483a6f45bb0",
  "requested_by": "codex-p04-additional-draft-author",
  "human_review_required": true
}
